{
  "$schema": "https://json-schema.org/draft/2020-12/schema",
  "$id": "https://omanome.dev/schema/config-v2.json",
  "title": "Omanome configuration",
  "type": "object",
  "required": ["schemaVersion"],
  "properties": {
    "schemaVersion": { "const": 2 },
    "general": { "type": "object" },
    "appearance": { "type": "object" },
    "controlCenter": {
      "type": "object",
      "properties": {
        "enabled": { "type": "boolean" },
        "masterEnabled": { "type": "boolean" },
        "suspended": { "type": "boolean" },
        "widget": {
          "type": "object",
          "properties": {
            "enabled": { "type": "boolean" },
            "position": { "enum": ["left", "center", "right"] },
            "clickAction": { "type": "string" },
            "rightClickAction": { "type": "string" },
            "longPressAction": { "type": "string" },
            "showLabel": { "type": "boolean" }
          }
        },
        "compactToggles": { "type": "array", "items": { "type": "string" } },
        "visibleModules": { "type": "array", "items": { "type": "string" } },
        "moduleOrder": { "type": "array", "items": { "type": "string" } },
        "osd": { "type": "object" }
      }
    },
    "adaptive": {
      "type": "object",
      "properties": {
        "enabled": { "type": "boolean" },
        "profile": { "enum": ["auto", "desktop", "tablet", "hybrid", "presentation", "gaming", "custom"] },
        "automaticTransitions": { "type": "boolean" },
        "externalKeyboardPolicy": { "enum": ["nothing", "hide-osk", "hybrid", "desktop", "ask"] },
        "unknownKeyboardPolicy": { "enum": ["ignore", "generic", "hybrid", "desktop", "ask"] },
        "transition": { "type": "object" },
        "profiles": {
          "type": "object",
          "properties": {
            "auto": { "$ref": "#/$defs/profile" },
            "desktop": { "$ref": "#/$defs/profile" },
            "tablet": { "$ref": "#/$defs/profile" },
            "hybrid": { "$ref": "#/$defs/profile" },
            "presentation": { "$ref": "#/$defs/profile" },
            "gaming": { "$ref": "#/$defs/profile" },
            "custom": { "$ref": "#/$defs/profile" }
          }
        },
        "deviceRules": { "type": "array" },
        "dockedMode": {
          "type": "object",
          "properties": {
            "enabled": { "type": "boolean" },
            "trigger": { "enum": ["external-monitor-and-keyboard", "external-monitor"] },
            "profile": { "enum": ["desktop", "tablet", "hybrid"] },
            "keepTouch": { "type": "boolean" },
            "restoreAutoState": { "type": "boolean" },
            "rotation": { "enum": ["preserve", "auto", "locked", "unchanged"] },
            "debounceMs": { "type": "integer", "minimum": 80, "maximum": 1500 },
            "stabilityMs": { "type": "integer", "minimum": 0, "maximum": 1500 }
          }
        }
      }
    },
    "tabletMode": { "type": "object" },
    "input": {
      "type": "object",
      "properties": {
        "schemaVersion": { "const": 1 },
        "nativeBackend": { "enum": ["auto", "native", "fallback", "disabled"] },
        "allowWtypeFallback": { "type": "boolean" },
        "suppressOskOnPhysicalKeyboard": { "type": "boolean" },
        "suppressOskOnDetachableKeyboard": { "type": "boolean" },
        "suppressOskOnBluetoothKeyboard": { "type": "boolean" },
        "deviceHotplug": { "type": "boolean" },
        "safeModeDisableNative": { "type": "boolean" },
        "defaultOutput": { "type": "string" },
        "deviceMappings": { "type": "object" }
      }
    },
    "onboarding": { "type": "object" },
    "accessibility": { "type": "object" },
    "touch": { "type": "object" },
    "stylus": { "type": "object" },
    "windowControls": { "type": "object" },
    "quickSettings": { "type": "object" },
    "dock": { "type": "object" },
    "overview": { "type": "object" },
    "launcher": { "type": "object" },
    "multitasking": { "type": "object" },
    "keyboard": { "type": "object" },
    "clipboard": { "type": "object" },
    "notifications": { "type": "object" },
    "altTab": { "type": "object" },
    "blur": { "type": "object" },
    "effects": { "type": "object" },
    "animations": { "type": "object" },
    "performance": {
      "type": "object",
      "properties": {
        "mode": { "enum": ["automatic", "quality", "balanced", "performance", "battery-saver"] },
        "qualityPreset": { "enum": ["automatic", "quality", "balanced", "performance", "battery-saver"] },
        "adaptiveQuality": { "type": "boolean" },
        "highGpuThreshold": { "type": "number", "minimum": 0, "maximum": 1 },
        "gpuLoadSource": { "type": "string" },
        "disableOnBattery": { "type": "boolean" },
        "disableOnFullscreen": { "type": "boolean" },
        "fullscreenPolicy": { "enum": ["quality", "balanced", "performance", "battery-saver"] },
        "autoDisableOnFrameBudget": { "type": "boolean" }
      }
    },
    "applicationRules": { "type": "object" },
    "wobbly": { "type": "object" },
    "cube": { "type": "object" },
    "forceQuit": { "type": "object" },
    "rotation": {
      "type": "object",
      "properties": {
        "orientationDebounceMs": { "type": "integer", "minimum": 120, "maximum": 5000 },
        "minimumDwellMs": { "type": "integer", "minimum": 0, "maximum": 10000 }
      }
    },
    "privacy": { "type": "object" },
    "shortcuts": { "type": "object" },
    "updates": { "type": "object" },
    "recovery": { "type": "object" },
    "diagnostics": { "type": "object" }
  },
  "$defs": {
    "profile": {
      "type": "object",
      "properties": {
        "mode": { "enum": ["auto", "desktop", "tablet", "hybrid"] },
        "featureOverrides": { "type": "object" },
        "componentBehavior": { "type": "object" }
      }
    }
  },
  "additionalProperties": true
}
