{
  "schemaVersion": 2,
  "general": {
    "mode": "automatic",
    "profile": "Desktop",
    "language": "system",
    "reduceMotion": false,
    "largeUi": false,
    "inputDebounceMs": 320
  },
  "appearance": {
    "theme": "follow-omarchy",
    "accent": "follow-omarchy",
    "radius": 18,
    "opacity": 0.96,
    "density": "comfortable"
  },
  "tabletMode": {
    "enabled": true,
    "touchTarget": 48,
    "autoFromTouch": true,
    "autoFromStylus": true,
    "physicalKeyboardExit": true,
    "transitionDuration": 180,
    "dockPreference": "adaptive",
    "windowControls": "touch",
    "gestures": true
  },
  "onboarding": {
    "completed": false,
    "skipped": false,
    "version": 1,
    "privacyAcknowledged": false
  },
  "accessibility": {
    "touchTargetSize": "default",
    "textScale": 1.0,
    "highContrast": false,
    "reducedMotion": false,
    "reduceTransparency": false,
    "screenReaderHints": true
  },
  "touch": {
    "enabled": true,
    "edgeWidth": 36,
    "threshold": 96,
    "velocity": 0.35,
    "inertia": true,
    "invert": false,
    "threeFingerAction": "workspace",
    "fourFingerAction": "overview",
    "conflictPolicy": "disable-fullscreen",
    "disableOnFullscreen": true,
    "fullscreenAllowList": [],
    "fullscreenDenyList": [],
    "adaptiveTargetMode": "automatic"
  },
  "stylus": {
    "enabled": true,
    "pressureCurve": "linear",
    "pressureMin": 0.0,
    "pressureMax": 1.0,
    "palmRejection": "automatic",
    "palmBackend": "native-first",
    "hoverCursor": true,
    "showOskOnTextField": "ask",
    "annotation": true,
    "buttonMap": {
      "primary": "right-click",
      "secondary": "middle-click",
      "tertiary": "annotation",
      "eraser": "eraser"
    }
  },
  "windowControls": {
    "enabled": true,
    "show": "tablet",
    "minTarget": 48,
    "style": "gnome",
    "autoHide": true,
    "autoHideDelay": 1800,
    "position": "top-right",
    "opacity": 0.94
  },
  "quickSettings": {
    "wifi": true,
    "bluetooth": true,
    "airplane": true,
    "volume": true,
    "microphone": true,
    "brightness": true,
    "nightLight": true,
    "powerProfile": true,
    "theme": true,
    "dnd": true,
    "rotation": true,
    "keyboard": true,
    "stylus": true,
    "screenshot": true,
    "recording": true,
    "lock": true,
    "power": true
  },
  "dock": {
    "enabled": true,
    "position": "bottom",
    "mode": "floating",
    "iconSize": 48,
    "minIconSize": 40,
    "maxIconSize": 64,
    "dynamicSizing": true,
    "runningApplications": true,
    "showLauncher": true,
    "showSettings": false,
    "showTrash": false,
    "multipleWindowAction": "cycle",
    "autohide": true,
    "autohideMode": "intelligent",
    "revealByPointer": true,
    "revealByTouch": true,
    "edgePressure": 12,
    "revealDelay": 120,
    "hideDelay": 650,
    "dodgeMode": "active-window",
    "fullscreenHide": true,
    "margin": 18,
    "padding": 10,
    "spacing": 8,
    "radius": 22,
    "monitor": "active",
    "workspaceIsolation": false,
    "monitorIsolation": false,
    "backgroundOpacity": 0.82,
    "blur": true,
    "shadow": true,
    "border": true,
    "borderOpacity": 0.34,
    "indicatorStyle": "dot",
    "animation": "slide",
    "clickAction": "activate-or-launch",
    "middleClickAction": "new-window",
    "scrollAction": "workspace"
  },
  "overview": {
    "enabled": true,
    "style": "gnome",
    "animationDuration": 180,
    "blur": true,
    "showAllWorkspaces": false,
    "showDock": true,
    "workspaceMode": "dynamic",
    "fixedWorkspaceCount": 5,
    "workspaceOrientation": "horizontal",
    "search": true
  },
  "launcher": {
    "enabled": true,
    "categories": true,
    "favorites": [],
    "favoritesFirst": true,
    "folders": [],
    "showRecent": true,
    "recentApplications": [],
    "dragReorder": true,
    "contextMenu": true,
    "gridColumns": 6
  },
  "keyboard": {
    "enabled": true,
    "layout": "auto",
    "mode": "standard",
    "showNumberRow": true,
    "showModifierRow": true,
    "showNavigationRow": true,
    "showFunctionRow": false,
    "capsLock": true,
    "symbols": true,
    "suggestions": true,
    "autocorrect": false,
    "learning": false,
    "haptic": true,
    "sound": false,
    "autoShow": true,
    "height": 300,
    "toolbar": true,
    "toolbarOverflow": true,
    "keyPopup": true,
    "keyPopupScale": 1.25,
    "keyPopupDuration": 180,
    "longPress": true,
    "longPressDelay": 360,
    "repeatDelay": 420,
    "repeatRate": 55,
    "spaceCursor": true,
    "swipeLayerSwitch": true,
    "floating": {
      "x": 0.5,
      "y": 0.72,
      "width": 0.82,
      "snap": true
    },
    "split": {
      "gap": 24,
      "blockWidth": 0.43,
      "vertical": 0.72,
      "thumbReach": 0.62,
      "symmetric": true
    },
    "oneHanded": {
      "width": 0.72,
      "offset": 0.04,
      "scale": 0.92
    },
    "emojiCategory": "recent",
    "emojiRecent": [],
    "suggestionLocale": "auto"
  },
  "clipboard": {
    "enabled": true,
    "historyLimit": 100,
    "retentionDays": 30,
    "persist": true,
    "persistPinnedOnly": false,
    "maxStorageMb": 256,
    "pinning": true,
    "tags": true,
    "clearOnLogout": false,
    "excludedApps": [],
    "privateMode": false
  },
  "notifications": {
    "enabled": true,
    "groupByApp": true,
    "history": true,
    "timestamps": true,
    "actions": true,
    "maxHistory": 200,
    "perAppMute": [],
    "doNotDisturb": false
  },
  "altTab": {
    "style": "coverflow",
    "modes": ["coverflow", "carousel", "gnome", "grid", "compact"],
    "groupByApp": true,
    "scope": "current-workspace",
    "perspective": 0.8,
    "angle": 28,
    "spacing": 0.18,
    "scale": 0.82,
    "selectedScale": 1.0,
    "sideOpacity": 0.68,
    "dimBackground": 0.54,
    "reflection": false,
    "shadow": true,
    "showIcon": true,
    "showTitle": true,
    "showMetadata": true,
    "livePreview": "auto",
    "previewStreams": 3,
    "touchSwipe": true,
    "touchFling": true,
    "stylusPreciseSelection": true,
    "animationDuration": 160
  },
  "blur": {
    "enabled": true,
    "backend": "hyprland-layer-rule",
    "quality": "balanced",
    "batteryQuality": "battery-saver",
    "fullscreenQuality": "battery-saver",
    "highGpuQuality": "performance",
    "highGpuThreshold": 0.85,
    "reduceBlurWithMotion": true,
    "dock": true,
    "overview": true,
    "launcher": true,
    "quickSettings": true,
    "notificationCenter": true,
    "clipboard": true,
    "osk": true,
    "settings": true,
    "radius": 18,
    "passes": 2,
    "opacity": 0.9,
    "brightness": 0.85,
    "saturation": 1.1,
    "noise": 0.02,
    "vibrancy": 0.06,
    "tint": "",
    "border": true,
    "shadow": true,
    "surfaces": {
      "dock": { "enabled": true },
      "overview": { "enabled": true },
      "launcher": { "enabled": true },
      "quickSettings": { "enabled": true },
      "notifications": { "enabled": true },
      "clipboard": { "enabled": true },
      "altTab": { "enabled": true },
      "osk": { "enabled": true },
      "settings": { "enabled": true },
      "windowControls": { "enabled": true },
      "annotation": { "enabled": true }
    }
  },
  "effects": {
    "enabled": true,
    "wobblyWindows": false,
    "desktopCube": false,
    "companionPolicy": "auto",
    "existingCubeBackend": "detect",
    "disableOnBattery": true,
    "disableOnFullscreen": true,
    "performanceMode": "balanced"
  },
  "animations": {
    "enabled": true,
    "preset": "GNOME",
    "speedMultiplier": 1.0,
    "durationScale": 1.0,
    "easing": "standard",
    "springStrength": 0.65,
    "reducedMotion": false,
    "overview": true,
    "dockHoverZoom": true,
    "dockHoverScale": 1.2,
    "dockReveal": true,
    "notificationEntry": true
  },
  "performance": {
    "mode": "balanced",
    "qualityPreset": "balanced",
    "adaptiveQuality": true,
    "highGpuThreshold": 0.85,
    "gpuLoadSource": "backend-only",
    "disableOnBattery": true,
    "disableOnFullscreen": true,
    "fullscreenPolicy": "battery-saver",
    "autoDisableOnFrameBudget": false
  },
  "applicationRules": {
    "enabled": true,
    "rules": []
  },
  "wobbly": {
    "enabled": false,
    "profile": "subtle",
    "stiffness": 0.72,
    "friction": 0.78,
    "damping": 0.62,
    "mass": 1.0,
    "gridResolution": 8,
    "maxVertices": 1024,
    "maxDeformation": 0.035,
    "edgeResistance": 0.82,
    "velocityInfluence": 0.45,
    "snapStrength": 0.7,
    "onMove": true,
    "onResize": true,
    "onMaximize": true,
    "onOpen": false,
    "onClose": false,
    "excludeFullscreen": true,
    "excludeGames": true,
    "excludeSteam": true,
    "excludeVr": true,
    "excludeDrawingApps": true,
    "excludeMaximized": true,
    "allowXwayland": false,
    "excludedApps": []
  },
  "cube": {
    "enabled": false,
    "backend": "detect",
    "monitorMode": "active-monitor",
    "perspective": 0.82,
    "fieldOfView": 62,
    "radius": 1.0,
    "faceSpacing": 0.0,
    "background": "wallpaper",
    "opacity": 1.0,
    "zoom": 1.0,
    "parallax": 0.5,
    "reflection": false,
    "caps": true,
    "wrapAround": false,
    "animationDuration": 420,
    "easing": "spring",
    "touchInteractive": true,
    "touchpadOverride": false,
    "mouseDrag": true,
    "stylusDrag": true
  },
  "forceQuit": {
    "enabled": true,
    "policy": "graceful-term-kill",
    "gracefulTimeoutMs": 1500,
    "termTimeoutMs": 1000,
    "protectSessionProcesses": true,
    "allowProtectedOverride": false,
    "includeFlatpak": true,
    "includeContainers": false,
    "cancelOnEscape": true,
    "cancelOnRightClick": true,
    "cancelButton": true,
    "stylusSecondaryButton": true
  },
  "rotation": {
    "enabled": true,
    "lock": false,
    "orientation": "auto",
    "sensor": "auto",
    "outputPolicy": "mapped",
    "transformTouch": true,
    "transformStylus": true
  },
  "privacy": {